{
  "role": "drop-mango",
  "openwrt_version": "23.05.3",
  "openwrt_target": "ramips/mt76x8",
  "openwrt_profile": "glinet_gl-mt300n-v2",
  "image_sha256": "27482c10f204a73b74257e1737ac61bb39bbb486cb846e45f899570604d9278c",
  "image_size_bytes": 5767994,
  "package_list_sha256": "f15f3821be412c90222adf5a989fca6a3a1b378a77ae7428fcc6c157360ae01f",
  "source_date_epoch": 1714694400,
  "created_at": "2026-05-05T02:12:27Z",
  "builder_host": "02ad3c8b0040"
}
